{
  "$schema": "https://json-schema.org/draft/2020-12/schema",
  "$id": "https://jonibach.github.io/rulecad/schemas/problem.schema.json",
  "title": "rulecad optimisation problem",
  "description": "A part to optimise, flat (2D) or solid (3D), in projects/<project>/problems/<name>.json: where material may go, what must stay solid or empty, where it's held and loaded, and what it's made of. Numbers are expressions, as in objects: of its variables and the rule sets it uses. cad optimise runs it; a design reads the result through a variable of type problem.",
  "type": "object",
  "required": [
    "material",
    "cell",
    "space",
    "supports",
    "loads"
  ],
  "additionalProperties": false,
  "properties": {
    "$schema": {
      "type": "string"
    },
    "title": {
      "type": "string"
    },
    "description": {
      "type": "string"
    },
    "uses": {
      "type": "array",
      "items": {
        "type": "string"
      },
      "description": "Rule sets: the material's, the printer's, the part's own"
    },
    "variables": {
      "type": "object",
      "description": "As in objects"
    },
    "variants": {
      "type": "object",
      "additionalProperties": {
        "type": "object"
      },
      "description": "Named settings of variables with tweak ranges, picked as name:variant"
    },
    "material": {
      "type": "string",
      "description": "A rule set with modulus (MPa), poisson and, for safety factors, strength (MPa)"
    },
    "thickness": {
      "$ref": "#/$defs/expr",
      "description": "A flat (2D) problem's thickness, mm"
    },
    "cell": {
      "$ref": "#/$defs/expr",
      "description": "The grid's cell size, mm: smaller is finer and slower"
    },
    "volume": {
      "$ref": "#/$defs/expr",
      "description": "The share of the space to fill, 0 to 1 (keep regions count towards it): the stiffest layout that fills it. Give this or a stress limit"
    },
    "stress": {
      "$ref": "#/$defs/expr",
      "description": "A limit on von Mises stress (MPa), such as \"pla.strength / 3\": the lightest layout that keeps every cell under it (Senhora et al. 2020). Give this or a volume"
    },
    "filter": {
      "$ref": "#/$defs/expr",
      "description": "Filter radius, mm: about the thinnest member (default 1.5 cells)"
    },
    "penal": {
      "$ref": "#/$defs/expr",
      "description": "The penalty on part-solid cells (default 3)"
    },
    "projection": {
      "type": "boolean",
      "description": "Sharpen the result to solid and empty (default true)"
    },
    "steps": {
      "type": "integer",
      "description": "At most this many steps (default 300)"
    },
    "space": {
      "oneOf": [
        {
          "$ref": "#/$defs/region"
        },
        {
          "type": "array",
          "items": {
            "$ref": "#/$defs/region"
          }
        }
      ],
      "description": "Where material may go"
    },
    "keep": {
      "type": "array",
      "items": {
        "$ref": "#/$defs/region"
      },
      "description": "Must stay solid: bosses round bolt holes"
    },
    "avoid": {
      "type": "array",
      "items": {
        "$ref": "#/$defs/region"
      },
      "description": "Must stay empty: holes, clearances (avoid wins over keep)"
    },
    "supports": {
      "type": "array",
      "minItems": 1,
      "items": {
        "$ref": "#/$defs/support"
      }
    },
    "loads": {
      "type": "array",
      "minItems": 1,
      "items": {
        "$ref": "#/$defs/load"
      }
    },
    "cases": {
      "type": "object",
      "additionalProperties": {
        "$ref": "#/$defs/expr"
      },
      "description": "Each load case's weight in the optimisation (default 1); 0 analyses it without optimising for it"
    },
    "outline": {
      "type": "object",
      "additionalProperties": false,
      "properties": {
        "smooth": {
          "type": "integer",
          "description": "Smoothing passes for the outline (2D) or surface (3D), default 4"
        },
        "min_area": {
          "$ref": "#/$defs/expr",
          "description": "Holes and islands smaller than this (mm²) are dropped"
        }
      }
    },
    "critical": {
      "type": "boolean",
      "description": "Safety-critical (a pedal, a lever, a bracket that holds people): parts analysed under it are reported unverified until a test or an independent analysis is recorded against them"
    },
    "overhang": {
      "type": "string",
      "description": "3D: printable this way up ('+z', '-y', …), or a variable holding it, or 'none': only material supported from below at 45° or less"
    },
    "output": {
      "type": "object",
      "additionalProperties": false,
      "required": [
        "at",
        "direction"
      ],
      "description": "A mechanism's output: where it should move, along one axis, against a spring. The first load is then the input.",
      "properties": {
        "at": {
          "$ref": "#/$defs/point",
          "description": "The centre, mm"
        },
        "r": {
          "$ref": "#/$defs/expr"
        },
        "size": {
          "type": "array",
          "items": {
            "$ref": "#/$defs/expr"
          },
          "minItems": 2,
          "maxItems": 3
        },
        "length": {
          "$ref": "#/$defs/expr"
        },
        "axis": {
          "enum": [
            "x",
            "y",
            "z"
          ]
        },
        "direction": {
          "type": "array",
          "items": {
            "type": "number"
          },
          "minItems": 2,
          "maxItems": 3,
          "description": "Which way it should move: along one axis, like [-1, 0]"
        },
        "spring": {
          "$ref": "#/$defs/expr",
          "description": "The spring it works against, N/mm"
        },
        "label": {
          "type": "string"
        }
      }
    },
    "input_spring": {
      "$ref": "#/$defs/expr",
      "description": "With output: a spring the input pushes against, N/mm"
    }
  },
  "$defs": {
    "expr": {
      "type": [
        "number",
        "string"
      ]
    },
    "point": {
      "type": "array",
      "items": {
        "$ref": "#/$defs/expr"
      },
      "minItems": 2,
      "maxItems": 3
    },
    "region": {
      "type": "object",
      "additionalProperties": false,
      "properties": {
        "at": {
          "$ref": "#/$defs/point",
          "description": "The centre, mm: [x, y] in 2D, [x, y, z] in 3D"
        },
        "r": {
          "$ref": "#/$defs/expr",
          "description": "A circle's or ball's radius, or a cylinder's"
        },
        "size": {
          "type": "array",
          "items": {
            "$ref": "#/$defs/expr"
          },
          "minItems": 2,
          "maxItems": 3,
          "description": "A rectangle's or box's sides"
        },
        "length": {
          "$ref": "#/$defs/expr",
          "description": "3D: a cylinder's length (with r)"
        },
        "axis": {
          "enum": [
            "x",
            "y",
            "z"
          ],
          "description": "3D: the cylinder's axis (default z)"
        },
        "points": {
          "type": "array",
          "items": {
            "$ref": "#/$defs/point"
          },
          "minItems": 3,
          "description": "2D: a polygon's corners"
        },
        "part": {
          "type": "string",
          "description": "3D: a named part of another design in the project, as it's built: object.part"
        },
        "label": {
          "type": "string"
        },
        "teardrop": {
          "enum": [
            "up",
            "down",
            "+z",
            "-z",
            "+y",
            "-y",
            "+x",
            "-x"
          ],
          "description": "3D: a 45° point on the cylinder that way, so it prints without support: down for a boss (its underside), up for a hole (its roof). up and down follow the problem's overhang (+z when it's free); along the cylinder's axis it has none"
        }
      }
    },
    "support": {
      "type": "object",
      "required": [],
      "additionalProperties": false,
      "properties": {
        "at": {
          "$ref": "#/$defs/point",
          "description": "The centre, mm: [x, y] in 2D, [x, y, z] in 3D"
        },
        "r": {
          "$ref": "#/$defs/expr",
          "description": "A circle's or ball's radius, or a cylinder's"
        },
        "size": {
          "type": "array",
          "items": {
            "$ref": "#/$defs/expr"
          },
          "minItems": 2,
          "maxItems": 3,
          "description": "A rectangle's or box's sides"
        },
        "length": {
          "$ref": "#/$defs/expr",
          "description": "3D: a cylinder's length (with r)"
        },
        "axis": {
          "enum": [
            "x",
            "y",
            "z"
          ],
          "description": "3D: the cylinder's axis (default z)"
        },
        "points": {
          "type": "array",
          "items": {
            "$ref": "#/$defs/point"
          },
          "minItems": 3,
          "description": "2D: a polygon's corners"
        },
        "part": {
          "type": "string",
          "description": "3D: a named part of another design in the project, as it's built: object.part"
        },
        "label": {
          "type": "string"
        },
        "fix": {
          "type": "string",
          "pattern": "^[xyz]+$",
          "description": "Which ways it's held: x, y, z (default all)"
        },
        "teardrop": {
          "enum": [
            "up",
            "down",
            "+z",
            "-z",
            "+y",
            "-y",
            "+x",
            "-x"
          ],
          "description": "3D: a 45° point on the cylinder that way, so it prints without support: down for a boss (its underside), up for a hole (its roof). up and down follow the problem's overhang (+z when it's free); along the cylinder's axis it has none"
        }
      }
    },
    "load": {
      "type": "object",
      "required": [
        "force"
      ],
      "additionalProperties": false,
      "properties": {
        "at": {
          "$ref": "#/$defs/point",
          "description": "The centre, mm: [x, y] in 2D, [x, y, z] in 3D"
        },
        "r": {
          "$ref": "#/$defs/expr",
          "description": "A circle's or ball's radius, or a cylinder's"
        },
        "size": {
          "type": "array",
          "items": {
            "$ref": "#/$defs/expr"
          },
          "minItems": 2,
          "maxItems": 3,
          "description": "A rectangle's or box's sides"
        },
        "length": {
          "$ref": "#/$defs/expr",
          "description": "3D: a cylinder's length (with r)"
        },
        "axis": {
          "enum": [
            "x",
            "y",
            "z"
          ],
          "description": "3D: the cylinder's axis (default z)"
        },
        "points": {
          "type": "array",
          "items": {
            "$ref": "#/$defs/point"
          },
          "minItems": 3,
          "description": "2D: a polygon's corners"
        },
        "part": {
          "type": "string",
          "description": "3D: a named part of another design in the project, as it's built: object.part"
        },
        "label": {
          "type": "string"
        },
        "force": {
          "$ref": "#/$defs/point",
          "description": "x, y (and z), in N"
        },
        "case": {
          "type": "string",
          "description": "Its load case (default load)"
        },
        "teardrop": {
          "enum": [
            "up",
            "down",
            "+z",
            "-z",
            "+y",
            "-y",
            "+x",
            "-x"
          ],
          "description": "3D: a 45° point on the cylinder that way, so it prints without support: down for a boss (its underside), up for a hole (its roof). up and down follow the problem's overhang (+z when it's free); along the cylinder's axis it has none"
        }
      }
    }
  },
  "anyOf": [
    {
      "required": [
        "volume"
      ]
    },
    {
      "required": [
        "stress"
      ]
    }
  ]
}
